{
  "$schema": "./schema.json",
  "schemaVersion": 2,
  "adapterVersion": 8,
  "provider": "grok",
  "displayName": "Grok",
  "urls": {
    "app": "https://grok.com",
    "login": "https://grok.com",
    "match": ["grok.com/*"],
    "ssoMatch": ["x.com/*", "twitter.com/*", "accounts.x.ai/*", "auth.grokusercontent.com/*", "auth.grok.com/*", "challenges.cloudflare.com/*", "accounts.google.com.tw/*", "auth.grokipedia.com/*", "gsi.google.com/*", "https://www.google.com/accounts"]
  },
  "inputSelectors": ["[data-testid=\"chat-input\"] .ProseMirror[contenteditable=\"true\"]", "[data-testid=\"chat-input\"] [contenteditable=\"true\"]", ".ProseMirror[contenteditable=\"true\"]", "[contenteditable=\"true\"].ProseMirror", "div.ProseMirror[contenteditable=\"true\"]"],
  "sendButtonSelectors": ["button[data-testid=\"chat-submit\"]", "button[aria-label=\"Submit\"]", "form button[type=\"submit\"]", "button[type=\"submit\"]"],
  "responseSelectors": ["[data-testid=\"assistant-message\"] .response-content-markdown", "[data-testid=\"assistant-message\"]", ".response-content-markdown", ".message-bubble.assistant"],
  "loginDetectors": ["[data-testid=\"chat-input\"] .ProseMirror[contenteditable=\"true\"]", ".ProseMirror[contenteditable=\"true\"]", "[data-testid=\"chat-submit\"]"],
  "loggedOutDetectors": [{ "selector": "button", "textIncludes": "Sign in" }, { "selector": "button", "textIncludes": "Sign up" }, { "selector": "button", "textIncludes": "Log in" }, { "selector": "button", "textIncludes": "登入" }, { "selector": "button", "textIncludes": "註冊" }, { "selector": "button", "textIncludes": "登录" }, { "selector": "button", "textIncludes": "注册" }, { "selector": "button", "textIncludes": "ログイン" }, { "selector": "button", "textIncludes": "登録" }, { "selector": "button", "textIncludes": "Anmelden" }, { "selector": "button", "textIncludes": "Registrieren" }, "[data-testid=\"anon-paywall-sign-up-card\"]", "a[href^=\"/sign-in\"]", "a[href^=\"/sign-up\"]"],
  "thinkingDetectors": ["button[data-testid=\"chat-stop\"]", "button[aria-label=\"Stop\"]", "button[aria-label=\"Stop generating\"]", "button[aria-label=\"Stop response\"]", "[data-streaming=\"true\"]", { "selector": ".thinking-container", "textIncludes": "Thinking", "textExcludes": "Thought for" }],
  "stopButtonSelectors": ["button[data-testid=\"chat-stop\"]", "button[aria-label=\"Stop\"]", "button[aria-label=\"Stop generating\"]", "button[aria-label=\"Stop response\"]"],
  "inputStrategy": "prosemirror-paste",
  "sendStrategy": "click",
  "timing": { "doneDelayMs": 8000, "chunkDebounceMs": 600, "statusIntervalMs": 10000, "backupPollMs": 3000 }
}
