{
  "$schema": "./schema.json",
  "schemaVersion": 1,
  "adapterVersion": 1,
  "provider": "gemini",
  "displayName": "Gemini",
  "urls": {
    "app": "https://gemini.google.com/app",
    "login": "https://gemini.google.com/app",
    "match": ["gemini.google.com/*"],
    "ssoMatch": []
  },
  "inputSelectors": [".ql-editor[contenteditable=\"true\"]", "rich-textarea .ql-editor", "div[contenteditable=\"true\"][aria-label=\"Enter a prompt here\"]", "div[contenteditable=\"true\"][aria-label]", ".input-area [contenteditable=\"true\"]", "rich-textarea [contenteditable=\"true\"]"],
  "sendButtonSelectors": ["button.send-button", "button[aria-label=\"Send message\"]", "button[aria-label=\"Send\"]", "button[aria-label=\"傳送訊息\"]", "button[aria-label=\"送出\"]", "button[data-mat-icon-name=\"send\"]", ".send-button-container button", "button mat-icon[data-mat-icon-name=\"send\"]", ".action-wrapper button[aria-label]", ".input-area-container button.send", "button.send-message-button"],
  "responseSelectors": [".model-response-text .markdown", ".model-response-text", "model-response .markdown", "model-response message-content", ".response-content .markdown", ".message-content[data-message-id]"],
  "loginDetectors": [".ql-editor[contenteditable=\"true\"]", "rich-textarea [contenteditable=\"true\"]", "div[contenteditable=\"true\"][aria-label=\"Enter a prompt here\"]"],
  "loggedOutDetectors": [],
  "thinkingDetectors": [".loading-indicator", ".thinking-indicator", "mat-progress-bar", "button[aria-label=\"Stop response\"]", "button[aria-label=\"Stop\"]", "button[aria-label=\"停止回應\"]", ".response-streaming", "[data-test-id=\"response-loading\"]"],
  "stopButtonSelectors": ["button[aria-label=\"Stop response\"]", "button[aria-label=\"Stop\"]", "button[aria-label=\"停止回應\"]"],
  "inputStrategy": "quill-angular",
  "sendStrategy": "click",
  "timing": { "doneDelayMs": 4000, "chunkDebounceMs": 600, "statusIntervalMs": 10000, "backupPollMs": 3000 }
}
